{
  "$schema": "./UNI_PACK_PROVENANCE_COVERAGE_G13_B_SCHEMA.json",
  "schema_version": "G13-B-pack-provenance-coverage",
  "audit_id": "G13-B-pack-provenance-coverage",
  "metadata_only": true,
  "observed_at": "2026-10-18",
  "base_commit": "5563510cbf40c1e2a5476cb64be845947c68e710",
  "scope": {
    "course_root": "UNIVERSITA_EDILIZIA",
    "course_glob": "UNIVERSITA_EDILIZIA/**/COURSE.yaml",
    "expected_course_count": 71,
    "input_manifests": [
      "docs/coordination/UNI_CORPUS_LOTTO_G1.json",
      "Fondamenti_Pack/PROVENANCE_MANIFEST_G2.json",
      "UNIVERSITA_EDILIZIA/ENERGETICA_INCENTIVI_PACK/fonti/PROVENANCE_MANIFEST_G3_GSE_CT3.json",
      "docs/coordination/UNI_CORPUS_LOTTO_G5_ECFR.json",
      "docs/coordination/UNI_CORPUS_LOTTO_G10_B.json"
    ],
    "manifest_record_scope": "Manifest records and source_records explicitly present in the listed local manifests.",
    "matching_policy": "Only exact manifest scope.package, scope.source_path, or record locator/local path under the pack path establishes a match.",
    "no_semantic_matching": "COURSE.yaml fonti, course names, titles, document topics, and text similarity are never used for matching.",
    "excluded_payloads": [
      "COURSE.yaml source text beyond the observed fonti-field presence",
      "schede JSONL and course-card payloads",
      "PDF, XML, HTML, source text, exam questions, answers, and solutions",
      "live URL requests or current license/legal verification"
    ],
    "state_policy": "The audit emits only observed_local or blocked; missing or insufficient evidence is never promoted."
  },
  "manifest_inventory": [
    {
      "manifest_path": "docs/coordination/UNI_CORPUS_LOTTO_G1.json",
      "manifest_id": "G1-FONDAMENTI-GUTENBERG-RAW",
      "record_container": "records",
      "record_count": 14,
      "scope_package": null
    },
    {
      "manifest_path": "Fondamenti_Pack/PROVENANCE_MANIFEST_G2.json",
      "manifest_id": "G2-FONDAMENTI-PACK-G1-PROVENANCE",
      "record_container": "records",
      "record_count": 14,
      "scope_package": null
    },
    {
      "manifest_path": "UNIVERSITA_EDILIZIA/ENERGETICA_INCENTIVI_PACK/fonti/PROVENANCE_MANIFEST_G3_GSE_CT3.json",
      "manifest_id": "G3-2-ENERGETICA-GSE-CT3",
      "record_container": "records",
      "record_count": 2,
      "scope_package": "UNIVERSITA_EDILIZIA/ENERGETICA_INCENTIVI_PACK"
    },
    {
      "manifest_path": "docs/coordination/UNI_CORPUS_LOTTO_G5_ECFR.json",
      "manifest_id": "G5-ECFR-OSHA-1926",
      "record_container": "source_records",
      "record_count": 1,
      "scope_package": "Edilizia_Pack"
    },
    {
      "manifest_path": "docs/coordination/UNI_CORPUS_LOTTO_G10_B.json",
      "manifest_id": "G10-B-EU-EPBD-2024-1275",
      "record_container": "source_records",
      "record_count": 1,
      "scope_package": "docs/coordination"
    }
  ],
  "summary": {
    "pack_count": 71,
    "manifest_record_count": 32,
    "matched_pack_count": 1,
    "unmatched_pack_count": 70,
    "by_source_record_present": {
      "observed_local": 1,
      "blocked": 70
    },
    "by_locator_present": {
      "observed_local": 1,
      "blocked": 70
    },
    "by_license_status": {
      "observed_local": 0,
      "blocked": 71
    },
    "by_evidence_status": {
      "observed_local": 0,
      "blocked": 71
    },
    "remediation_required_count": 71
  },
  "packs": [
    {
      "pack_id": "ACUSTICA_EDILIZIA_PACK",
      "pack_path": "UNIVERSITA_EDILIZIA/ACUSTICA_EDILIZIA_PACK",
      "course_yaml": "UNIVERSITA_EDILIZIA/ACUSTICA_EDILIZIA_PACK/COURSE.yaml",
      "course_name": "Acustica edilizia",
      "fonti_field_present": true,
      "source_record_present": "blocked",
      "locator_present": "blocked",
      "license_status": "blocked",
      "evidence_status": "blocked",
      "remediation_required": true,
      "remediation_codes": [
        "source_record_missing_for_pack",
        "locator_missing_or_not_present_for_all_matched_records",
        "source_specific_license_not_declared",
        "evidence_not_observed_local_for_all_matched_records"
      ],
      "matched_source_records": [],
      "matching_note": "Match uses only explicit manifest scope/local path metadata; COURSE.yaml fonti, titles, and text similarity are not used to establish provenance."
    },
    {
      "pack_id": "AEROPORTI_E_INFRASTRUTTURE_DI_VOLO_PACK",
      "pack_path": "UNIVERSITA_EDILIZIA/AEROPORTI_E_INFRASTRUTTURE_DI_VOLO_PACK",
      "course_yaml": "UNIVERSITA_EDILIZIA/AEROPORTI_E_INFRASTRUTTURE_DI_VOLO_PACK/COURSE.yaml",
      "course_name": "Aeroporti e infrastrutture di volo",
      "fonti_field_present": false,
      "source_record_present": "blocked",
      "locator_present": "blocked",
      "license_status": "blocked",
      "evidence_status": "blocked",
      "remediation_required": true,
      "remediation_codes": [
        "source_record_missing_for_pack",
        "locator_missing_or_not_present_for_all_matched_records",
        "source_specific_license_not_declared",
        "evidence_not_observed_local_for_all_matched_records"
      ],
      "matched_source_records": [],
      "matching_note": "Match uses only explicit manifest scope/local path metadata; COURSE.yaml fonti, titles, and text similarity are not used to establish provenance."
    },
    {
      "pack_id": "ARCHITETTURA_PACK",
      "pack_path": "UNIVERSITA_EDILIZIA/ARCHITETTURA_PACK",
      "course_yaml": "UNIVERSITA_EDILIZIA/ARCHITETTURA_PACK/COURSE.yaml",
      "course_name": "Architettura",
      "fonti_field_present": false,
      "source_record_present": "blocked",
      "locator_present": "blocked",
      "license_status": "blocked",
      "evidence_status": "blocked",
      "remediation_required": true,
      "remediation_codes": [
        "source_record_missing_for_pack",
        "locator_missing_or_not_present_for_all_matched_records",
        "source_specific_license_not_declared",
        "evidence_not_observed_local_for_all_matched_records"
      ],
      "matched_source_records": [],
      "matching_note": "Match uses only explicit manifest scope/local path metadata; COURSE.yaml fonti, titles, and text similarity are not used to establish provenance."
    },
    {
      "pack_id": "ASCENSORI_E_MOVIMENTAZIONE_VERTICALE_PACK",
      "pack_path": "UNIVERSITA_EDILIZIA/ASCENSORI_E_MOVIMENTAZIONE_VERTICALE_PACK",
      "course_yaml": "UNIVERSITA_EDILIZIA/ASCENSORI_E_MOVIMENTAZIONE_VERTICALE_PACK/COURSE.yaml",
      "course_name": "Ascensori e movimentazione verticale",
      "fonti_field_present": false,
      "source_record_present": "blocked",
      "locator_present": "blocked",
      "license_status": "blocked",
      "evidence_status": "blocked",
      "remediation_required": true,
      "remediation_codes": [
        "source_record_missing_for_pack",
        "locator_missing_or_not_present_for_all_matched_records",
        "source_specific_license_not_declared",
        "evidence_not_observed_local_for_all_matched_records"
      ],
      "matched_source_records": [],
      "matching_note": "Match uses only explicit manifest scope/local path metadata; COURSE.yaml fonti, titles, and text similarity are not used to establish provenance."
    },
    {
      "pack_id": "BONIFICA_SITI_AMBIENTALI_EDILIZIA_PACK",
      "pack_path": "UNIVERSITA_EDILIZIA/BONIFICA_SITI_AMBIENTALI_EDILIZIA_PACK",
      "course_yaml": "UNIVERSITA_EDILIZIA/BONIFICA_SITI_AMBIENTALI_EDILIZIA_PACK/COURSE.yaml",
      "course_name": "Bonifica siti ambientali per l'edilizia",
      "fonti_field_present": false,
      "source_record_present": "blocked",
      "locator_present": "blocked",
      "license_status": "blocked",
      "evidence_status": "blocked",
      "remediation_required": true,
      "remediation_codes": [
        "source_record_missing_for_pack",
        "locator_missing_or_not_present_for_all_matched_records",
        "source_specific_license_not_declared",
        "evidence_not_observed_local_for_all_matched_records"
      ],
      "matched_source_records": [],
      "matching_note": "Match uses only explicit manifest scope/local path metadata; COURSE.yaml fonti, titles, and text similarity are not used to establish provenance."
    },
    {
      "pack_id": "CAD_BIM_PROGETTAZIONE_PACK",
      "pack_path": "UNIVERSITA_EDILIZIA/CAD_BIM_PROGETTAZIONE_PACK",
      "course_yaml": "UNIVERSITA_EDILIZIA/CAD_BIM_PROGETTAZIONE_PACK/COURSE.yaml",
      "course_name": "Progettazione digitale CAD e BIM",
      "fonti_field_present": false,
      "source_record_present": "blocked",
      "locator_present": "blocked",
      "license_status": "blocked",
      "evidence_status": "blocked",
      "remediation_required": true,
      "remediation_codes": [
        "source_record_missing_for_pack",
        "locator_missing_or_not_present_for_all_matched_records",
        "source_specific_license_not_declared",
        "evidence_not_observed_local_for_all_matched_records"
      ],
      "matched_source_records": [],
      "matching_note": "Match uses only explicit manifest scope/local path metadata; COURSE.yaml fonti, titles, and text similarity are not used to establish provenance."
    },
    {
      "pack_id": "CAPOLAVORI_E_STORIA_OPERE_PACK",
      "pack_path": "UNIVERSITA_EDILIZIA/CAPOLAVORI_E_STORIA_OPERE_PACK",
      "course_yaml": "UNIVERSITA_EDILIZIA/CAPOLAVORI_E_STORIA_OPERE_PACK/COURSE.yaml",
      "course_name": "Capolavori e storia delle opere",
      "fonti_field_present": false,
      "source_record_present": "blocked",
      "locator_present": "blocked",
      "license_status": "blocked",
      "evidence_status": "blocked",
      "remediation_required": true,
      "remediation_codes": [
        "source_record_missing_for_pack",
        "locator_missing_or_not_present_for_all_matched_records",
        "source_specific_license_not_declared",
        "evidence_not_observed_local_for_all_matched_records"
      ],
      "matched_source_records": [],